[
  {"profileId":"pixel_sailfish","model":"Pixel","manufacturer":"Google","brand":"google","device":"sailfish","product":"sailfish","board":"sailfish","sourceId":"sailfish"},
  {"profileId":"pixel_marlin","model":"Pixel XL","manufacturer":"Google","brand":"google","device":"marlin","product":"marlin","board":"marlin","sourceId":"marlin"},
  {"profileId":"pixel_walleye","model":"Pixel 2","manufacturer":"Google","brand":"google","device":"walleye","product":"walleye","board":"walleye","sourceId":"walleye"},
  {"profileId":"pixel_taimen","model":"Pixel 2 XL","manufacturer":"Google","brand":"google","device":"taimen","product":"taimen","board":"taimen","sourceId":"taimen"},
  {"profileId":"pixel_blueline","model":"Pixel 3","manufacturer":"Google","brand":"google","device":"blueline","product":"blueline","board":"blueline","sourceId":"blueline"},
  {"profileId":"pixel_crosshatch","model":"Pixel 3 XL","manufacturer":"Google","brand":"google","device":"crosshatch","product":"crosshatch","board":"crosshatch","sourceId":"crosshatch"},
  {"profileId":"pixel_sargo","model":"Pixel 3a","manufacturer":"Google","brand":"google","device":"sargo","product":"sargo","board":"sargo","sourceId":"sargo"},
  {"profileId":"pixel_bonito","model":"Pixel 3a XL","manufacturer":"Google","brand":"google","device":"bonito","product":"bonito","board":"bonito","sourceId":"bonito"},
  {"profileId":"pixel_flame","model":"Pixel 4","manufacturer":"Google","brand":"google","device":"flame","product":"flame","board":"flame","sourceId":"flame"},
  {"profileId":"pixel_coral","model":"Pixel 4 XL","manufacturer":"Google","brand":"google","device":"coral","product":"coral","board":"coral","sourceId":"coral"},
  {"profileId":"pixel_sunfish","model":"Pixel 4a","manufacturer":"Google","brand":"google","device":"sunfish","product":"sunfish","board":"sunfish","sourceId":"sunfish"},
  {"profileId":"pixel_bramble","model":"Pixel 4a (5G)","manufacturer":"Google","brand":"google","device":"bramble","product":"bramble","board":"bramble","sourceId":"bramble"},
  {"profileId":"pixel_redfin","model":"Pixel 5","manufacturer":"Google","brand":"google","device":"redfin","product":"redfin","board":"redfin","sourceId":"redfin"},
  {"profileId":"pixel_barbet","model":"Pixel 5a (5G)","manufacturer":"Google","brand":"google","device":"barbet","product":"barbet","board":"barbet","sourceId":"barbet"},
  {"profileId":"pixel_oriole","model":"Pixel 6","manufacturer":"Google","brand":"google","device":"oriole","product":"oriole","board":"oriole","sourceId":"oriole"},
  {"profileId":"pixel_raven","model":"Pixel 6 Pro","manufacturer":"Google","brand":"google","device":"raven","product":"raven","board":"raven","sourceId":"raven"},
  {"profileId":"pixel_bluejay","model":"Pixel 6a","manufacturer":"Google","brand":"google","device":"bluejay","product":"bluejay","board":"bluejay","sourceId":"bluejay"},
  {"profileId":"pixel_panther","model":"Pixel 7","manufacturer":"Google","brand":"google","device":"panther","product":"panther","board":"panther","sourceId":"panther"},
  {"profileId":"pixel_cheetah","model":"Pixel 7 Pro","manufacturer":"Google","brand":"google","device":"cheetah","product":"cheetah","board":"cheetah","sourceId":"cheetah"},
  {"profileId":"pixel_lynx","model":"Pixel 7a","manufacturer":"Google","brand":"google","device":"lynx","product":"lynx","board":"lynx","sourceId":"lynx"},
  {"profileId":"pixel_felix","model":"Pixel Fold","manufacturer":"Google","brand":"google","device":"felix","product":"felix","board":"felix","sourceId":"felix"},
  {"profileId":"pixel_tangorpro","model":"Pixel Tablet","manufacturer":"Google","brand":"google","device":"tangorpro","product":"tangorpro","board":"tangorpro","sourceId":"tangorpro"},
  {"profileId":"pixel_shiba","model":"Pixel 8","manufacturer":"Google","brand":"google","device":"shiba","product":"shiba","board":"shiba","sourceId":"shiba"},
  {"profileId":"pixel_husky","model":"Pixel 8 Pro","manufacturer":"Google","brand":"google","device":"husky","product":"husky","board":"husky","sourceId":"husky"},
  {"profileId":"pixel_akita","model":"Pixel 8a","manufacturer":"Google","brand":"google","device":"akita","product":"akita","board":"akita","sourceId":"akita"},
  {"profileId":"pixel_tokay","model":"Pixel 9","manufacturer":"Google","brand":"google","device":"tokay","product":"tokay","board":"tokay","sourceId":"tokay"},
  {"profileId":"pixel_caiman","model":"Pixel 9 Pro","manufacturer":"Google","brand":"google","device":"caiman","product":"caiman","board":"caiman","sourceId":"caiman"},
  {"profileId":"pixel_komodo","model":"Pixel 9 Pro XL","manufacturer":"Google","brand":"google","device":"komodo","product":"komodo","board":"komodo","sourceId":"komodo"},
  {"profileId":"pixel_comet","model":"Pixel 9 Pro Fold","manufacturer":"Google","brand":"google","device":"comet","product":"comet","board":"comet","sourceId":"comet"},
  {"profileId":"pixel_tegu","model":"Pixel 9a","manufacturer":"Google","brand":"google","device":"tegu","product":"tegu","board":"tegu","sourceId":"tegu"},
  {"profileId":"pixel_frankel","model":"Pixel 10","manufacturer":"Google","brand":"google","device":"frankel","product":"frankel","board":"frankel","sourceId":"frankel"},
  {"profileId":"pixel_blazer","model":"Pixel 10 Pro","manufacturer":"Google","brand":"google","device":"blazer","product":"blazer","board":"blazer","sourceId":"blazer"},
  {"profileId":"pixel_mustang","model":"Pixel 10 Pro XL","manufacturer":"Google","brand":"google","device":"mustang","product":"mustang","board":"mustang","sourceId":"mustang"},
  {"profileId":"pixel_rango","model":"Pixel 10 Pro Fold","manufacturer":"Google","brand":"google","device":"rango","product":"rango","board":"rango","sourceId":"rango"},
  {"profileId":"pixel_stallion","model":"Pixel 10a","manufacturer":"Google","brand":"google","device":"stallion","product":"stallion","board":"stallion","sourceId":"stallion"}
]
